Post_Title,Date_Posted,Impressions,Engagement_Rate,Reactions,Comments,Shares,CTR
Why African Startups Fail in Their Own Markets,2025-04-22,153240,0.087,255,66,12,0.042
Africa Is Not Hard It’s Just Not Googleable,2025-07-26,143890,0.091,288,48,19,0.044
Why Global Brands Struggle in East Africa,2024-12-15,129560,0.084,230,55,21,0.038
Why Malls Struggle Even When They’re Full,2025-03-11,118320,0.079,212,44,15,0.036
The African Startups Playbook Launch,2025-01-09,138400,0.092,271,52,13,0.041
The MVR Framework Explained,2025-05-18,102870,0.081,198,39,9,0.034
